{
  "$schema": "http://json-schema.org/draft-07/schema#",
  "$id": "https://example.com/complex-schema.json",
  "title": "Complex Schema Example",
  "description": "A highly complex JSON schema demonstrating all possible attributes.",
  "$comment": "This schema is for demonstration purposes only.",
  "definitions": {
    "address": {
      "type": "object",
      "properties": {
        "street": { "type": "string" },
        "city": { "type": "string" },
        "zip": { "type": "string", "pattern": "^\\d{5}$" }
      },
      "required": ["street", "city", "zip"]
    }
  },
  "type": "object",
  "properties": {
    "id": {
      "type": "string",
      "pattern": "^[a-fA-F0-9]{8}-[a-fA-F0-9]{4}-[a-fA-F0-9]{4}-[a-fA-F0-9]{4}-[a-fA-F0-9]{12}$"
    },
    "name": {
      "type": "string",
      "minLength": 1,
      "maxLength": 100
    },
    "email": {
      "type": "string",
      "format": "email"
    },
    "age": {
      "type": "integer",
      "minimum": 18,
      "maximum": 120,
      "exclusiveMinimum": 17,
      "exclusiveMaximum": 121
    },
    "salary": {
      "type": "number",
      "multipleOf": 0.01,
      "minimum": 0,
      "maximum": 1000000
    },
    "preferences": {
      "type": "object",
      "properties": {
        "newsletter": { "type": "boolean" },
        "theme": {
          "type": "string",
          "enum": ["light", "dark", "system"],
          "default": "system"
        }
      },
      "required": ["newsletter"],
      "additionalProperties": false
    },
    "tags": {
      "type": "array",
      "items": { "type": "string", "minLength": 1, "maxLength": 20 },
      "minItems": 1,
      "maxItems": 5,
      "uniqueItems": true
    },
    "profileImage": {
      "type": "string",
      "contentMediaType": "image/png",
      "contentEncoding": "base64"
    },
    "metadata": {
      "type": "object",
      "patternProperties": {
        "^[a-zA-Z0-9_]+$": { "type": "string" }
      },
      "additionalProperties": false
    },
    "contact": {
      "oneOf": [
        { "$ref": "#/definitions/address" },
        {
          "type": "object",
          "properties": {
            "phone": { "type": "string", "pattern": "^\\+\\d{1,3}\\d{9}$" }
          },
          "required": ["phone"]
        }
      ]
    },
    "status": {
      "type": "string",
      "const": "active"
    },
    "history": {
      "type": "array",
      "prefixItems": [
        { "type": "string" },
        { "type": "integer" }
      ],
      "items": { "type": "boolean" },
      "contains": {
        "type": "boolean",
        "const": true
      },
      "minContains": 1,
      "maxContains": 2
    },
    "dynamicData": {
      "$dynamicRef": "#dynamicAnchor",
      "$dynamicAnchor": "dynamicAnchor"
    }
  },
  "required": ["id", "name", "email", "age"],
  "allOf": [
    {
      "if": {
        "properties": { "age": { "minimum": 60 } }
      },
      "then": {
        "properties": { "preferences": { "required": ["theme"] } }
      }
    }
  ],
  "dependentRequired": {
    "preferences": ["tags"]
  },
  "dependentSchemas": {
    "profileImage": {
      "properties": {
        "metadata": { "required": ["role"] }
      }
    }
  },
  "unevaluatedProperties": false,
  "unevaluatedItems": false,
  "$vocabulary": {
    "https://json-schema.org/draft/2020-12/vocab/core": true,
    "https://json-schema.org/draft/2020-12/vocab/applicator": true
  },
  "examples": [
    {
      "id": "123e4567-e89b-12d3-a456-426614174000",
      "name": "John Doe",
      "email": "john.doe@example.com",
      "age": 30,
      "salary": 50000.50,
      "preferences": {
        "newsletter": true,
        "theme": "dark"
      },
      "tags": ["developer", "backend"],
      "profileImage": "iVBORw0KGgoAAAANSUhEUgAAAAEAAAABCAQAAAC1HAwCAAAAC0lEQVR42mP8/wcAAgAB/0z1rAAAAABJRU5ErkJggg==",
      "metadata": {
        "role": "admin"
      },
      "contact": {
        "street": "123 Main St",
        "city": "Springfield",
        "zip": "12345"
      },
      "status": "active",
      "history": ["started", 2020, true]
    }
  ]
}
